industry,pain_point,slug
Bulldozer Drivers,sharpening blades and site leveling,best-crm-bulldozer-drivers
Excavator Operators,replacing bucket teeth and dig depth,best-crm-excavator-operators
Forklift Mechanics,charging batteries and fork adjustments,best-crm-forklift-mechanics
Warehouse Forklifts,stacking pallets and aisle navigation,best-crm-warehouse-forklifts
Shipping Dock Workers,loading containers and manifest verification,best-crm-shipping-dock-workers
Port Crane Operators,slinging cargo and load balancing,best-crm-port-crane-operators
Fishery Processors,filleting fish and packing lines,best-crm-fishery-processors
Cannery Workers,applying labels and can sealing,best-crm-cannery-workers
Bakery Production,mixing dough and oven timing,best-crm-bakery-production
Food Processing,inspecting quality and line efficiency,best-crm-food-processing
Beverage Bottlers,filling lines and cap tightening,best-crm-beverage-bottlers
Pharma Packagers,counting pills and blister packing,best-crm-pharma-packagers
Textile Weavers,threading looms and pattern weaving,best-crm-textile-weavers
Garment Factories,stitching seams and quality checks,best-crm-garment-factories
Shoe Manufacturers,gluing soles and last shaping,best-crm-shoe-manufacturers
Leather Workers,tanning hides and cutting patterns,best-crm-leather-workers
Furniture Assembly,fastening joints and upholstery stapling,best-crm-furniture-assembly
Toy Manufacturers,molding parts and safety testing,best-crm-toy-manufacturers
Electronics Assembly,soldering circuits and board testing,best-crm-electronics-assembly
Appliance Manufacturers,running assembly lines and quality assurance,best-crm-appliance-manufacturers
Automotive Assembly,torquing bolts and paint booths,best-crm-automotive-assembly
Aerospace Manufacturing,setting rivets and wind tunnel tests,best-crm-aerospace-manufacturing
Shipbuilders,seaming welds and dry dock launches,best-crm-shipbuilders
Railcar Builders,attaching bogies and brake systems,best-crm-railcar-builders
Bicycle Manufacturers,welding frames and wheel truing,best-crm-bicycle-manufacturers
Sports Equipment Makers,inflating balls and material testing,best-crm-sports-equipment-makers
Musical Instrument Craftsmen,tuning strings and varnish application,best-crm-musical-instrument-craftsmen
Art Supply Manufacturers,mixing paints and brush bristle selection,best-crm-art-supply-manufacturers
Office Supply Distributors,shelving stock and order picking,best-crm-office-supply-distributors
Hardware Stores,inventorying tools and customer advice,best-crm-hardware-stores
Garden Centers,watering plants and seasonal displays,best-crm-garden-centers
Pet Supply Shops,bagging food and toy recommendations,best-crm-pet-supply-shops
Grocery Stores,stocking shelves and produce rotation,best-crm-grocery-stores
Supermarket Managers,rotating produce and inventory scans,best-crm-supermarket-managers
Convenience Stores,registering cash and stock replenishment,best-crm-convenience-stores
Pharmacies,filling prescriptions and insurance verification,best-crm-pharmacies
Health Food Stores,labeling supplements and nutrition advice,best-crm-health-food-stores
Liquor Stores,stocking bottles and age verification,best-crm-liquor-stores
Wine Shops,hosting tastings and cellar recommendations,best-crm-wine-shops
Beer Distributors,tapping kegs and delivery routes,best-crm-beer-distributors
Coffee Shops,grinding beans and latte art,best-crm-coffee-shops
Tea Houses,steeping leaves and blend creation,best-crm-tea-houses
Ice Cream Parlors,serving scoops and flavor rotations,best-crm-ice-cream-parlors
Candy Stores,wrapping sweets and bulk bin refills,best-crm-candy-stores
Chocolate Makers,tempering cacao and mold filling,best-crm-chocolate-makers
Popcorn Vendors,popping kernels and flavor tossing,best-crm-popcorn-vendors
Street Food Vendors,setting up carts and menu boards,best-crm-street-food-vendors
Food Truck Owners,boarding menus and location tracking,best-crm-food-truck-owners
Catering Services,setting up events and dietary accommodations,best-crm-catering-services
Banquet Halls,arranging tables and AV setups,best-crm-banquet-halls
Wedding Venues,hanging decor and vendor coordination,best-crm-wedding-venues
Conference Centers,testing AV and room configurations,best-crm-conference-centers
Hotels,cleaning rooms and front desk check-ins,best-crm-hotels
Motels,desking check-ins and room turnover,best-crm-motels
Bed and Breakfasts,prepping breakfasts and guest preferences,best-crm-bed-and-breakfasts
Hostels,assigning bunks and locker rentals,best-crm-hostels
Airbnbs,reviewing guests and cleaning schedules,best-crm-airbnbs
Vacation Rentals,handing off keys and maintenance requests,best-crm-vacation-rentals
Timeshare Managers,allocating weeks and owner communications,best-crm-timeshare-managers
Campgrounds,pitching tents and fire pit safety,best-crm-campgrounds
RV Parks,hooking up sites and utility metering,best-crm-rv-parks
Glamping Sites,setting luxury tents and amenity stocking,best-crm-glamping-sites
Eco Lodges,walking nature and sustainability education,best-crm-eco-lodges
Ski Lodges,passing lifts and gear rentals,best-crm-ski-lodges
Beach Resorts,renting cabanas and tide schedules,best-crm-beach-resorts
Mountain Cabins,stocking firewood and trail maps,best-crm-mountain-cabins
Lake Houses,docking boats and fishing permits,best-crm-lake-houses
Island Retreats,scheduling ferries and excursion bookings,best-crm-island-retreats
Safari Lodges,driving games and wildlife sightings,best-crm-safari-lodges
Jungle Camps,touring canopies and insect netting,best-crm-jungle-camps
Desert Oases,riding camels and star gazing,best-crm-desert-oases
Polar Expeditions,navigating icebreakers and gear checks,best-crm-polar-expeditions
Space Tourism,booking orbits and zero-g training,best-crm-space-tourism